{
    "$schema": "../../level.schema.json",
    "meta": {
        "name": "foo",
        "author": "bar",
        "version": 1
    },
    "targets": 3,
    "width": 16,
    "height": 16,
    "map": [
        "#########E######",
        "#              #",
        "#              #",
        "#              #",
        "#              #",
        "#              #",
        "#              #",
        "#    .         #",
        "#              #",
        "#              #",
        "#              #",
        "#              #",
        "#       .      #",
        "#              #",
        "#              #",
        "###S############"
    ]
}